FILENAME,TEXT,FOUND_PROPER_NOUN,MISSED_PROPER_NOUN,FOUND_PRONOUN,MISSED_PRONOUN
stevenson_the_strange_case_of_drjekyll_and_mrhyde," INCIDENT OF THE LETTER   [It]_p740 was late in the afternoon, when Mr Utterson found [his]_p741 way to Dr Jekyll's door, where [he]_p742 was at once admitted by Poole, and carried down by the kitchen offices and across a yard which had once been a garden, to the building which was indifferently known as the laboratory or dissecting rooms. The doctor had bought the house from the heirs of a celebrated surgeon and [his]_p743 own tastes being rather chemical than anatomical, had changed the destination of the block at the bottom of the garden. [It]_p744 was the first time that the lawyer had been received in that part of [his]_p745 friend's quarters and [he]_p746 eyed the dingy, windowless structure with curiosity, and gazed round with a distasteful sense of strangeness as [he]_p747 crossed the [theatre]_n168 , once crowded with eager students and now lying gaunt and silent, the tables laden with chemical apparatus, the floor strewn with crates and littered with packing straw, and the light falling dimly through the foggy cupola. At the further end, a flight of stairs mounted to a door covered with red baize and through this, [Mr Utterson]_n169 was at last received into the doctor's cabinet. [It]_p748 was a large room fitted round with glass presses, furnished, among other things, with a cheval-glass and a business table, and looking out upon the court by three dusty windows barred with iron. The fire burned in the grate a lamp was set lighted on the chimney shelf, for even in the houses the fog began to lie thickly and there, close up to the warmth, sat Dr Jekyll, looking deathly sick. [He]_p749 did not rise to meet [his]_p750 visitor, but held out a cold hand and bade [him]_p751 welcome in a changed voice. ""And now,"". said [Mr Utterson]_n170 , as soon as [Poole]_n171 had left them,. ""[you]_p752 have heard the news?   The doctor shuddered.",4,,13,
stevenson_the_strange_case_of_drjekyll_and_mrhyde," ""[They]_p753 were crying [it]_p754 in the square,"". [he]_p755 said. ""[I]_p756 heard [them]_p757 in [my]_p758 dining-room. ""One word,"". said the lawyer. ""[Carew]_n172 was [my]_p759 client, but so are you, and [I]_p760 want to know what [I]_p761 am doing. [You]_p762 have not been mad enough to hide this fellow?. ""[Utterson]_n173 , [I]_p763 swear to God,"". cried the doctor,. ""[I]_p764 swear to God [I]_p765 will never set eyes on [him]_p766 again.",2,,14,
stevenson_the_strange_case_of_drjekyll_and_mrhyde," [I]_p767 bind [my]_p769 honour to [you]_p770 that [I]_p768 am done with [him]_p771 in this world. [It]_p772 is all at an end. And indeed [he]_p773 does not want [my]_p777 help [you]_p779 do not know [him]_p780 as [I]_p781 do [he]_p774 is safe, [he]_p774 is quite safe mark [my]_p778 words, [he]_p775 will never more be heard of. The lawyer listened gloomily [he]_p782 did not like [his]_p783 friend's feverish manner. ""[You]_p784 seem pretty sure of him,"". said [he]_p785. ""and for [your]_p786 sake, [I]_p787 hope [you]_p788 may be right. If [it]_p789 came to a trial, [your]_p790 name might appear. ""[I]_p791 am quite sure of him,"". replied [Jekyll]_n174.",1,,25,
stevenson_the_strange_case_of_drjekyll_and_mrhyde," ""[I]_p792 have grounds for certainty that [I]_p793 cannot share with any one. But there is one thing on which [you]_p794 may advise me. [I]_p795 have, [I]_p796 have received a letter and [I]_p796 am at a loss whether [I]_p797 should show [it]_p799 to the police. [I]_p800 should like to leave [it]_p803 in [your]_p804 hands, [Utterson]_n175 [you]_p805 would judge wisely, [I]_p801 am sure [I]_p801 have so great a trust in you. ""[You]_p807 fear, [I]_p808 suppose, that [it]_p809 might lead to [his]_p810 detection?"". asked the lawyer. ""No,"". said the other. ""[I]_p811 cannot say that [I]_p812 care what becomes of [Hyde]_n176 [I]_p812 am quite done with him. [I]_p814 was thinking of [my]_p815 own character, which this hateful business has rather exposed.",2,,23,
stevenson_the_strange_case_of_drjekyll_and_mrhyde," [Utterson]_n177 ruminated awhile [he]_p816 was surprised at [his]_p817 friend's selfishness, and yet relieved by it. ""Well,"". said he, at last,. ""let [me]_p818 see the letter. The letter was written in an odd, upright hand and signed. ""Edward Hyde : and [it]_p819 signified, briefly enough, that the writer's benefactor, Dr Jekyll, whom [he]_p820 had long so unworthily repaid for a thousand generosities, need labour under no alarm for [his]_p823 safety, as [he]_p821 had means of escape on which [he]_p821 placed a sure dependence. The lawyer liked this letter well enough [it]_p824 put a better colour on the intimacy than [he]_p825 had looked for and [he]_p826 blamed [himself]_p827 for some of [his]_p828 past suspicions. ""Have [you]_p829 the envelope?"". [he]_p830 asked. ""[I]_p831 burned it,"".",1,,16,
stevenson_the_strange_case_of_drjekyll_and_mrhyde," replied [Jekyll]_n178 ,. ""before [I]_p832 thought what [I]_p833 was about. But [it]_p834 bore no postmark. The note was handed in. ""Shall [I]_p835 keep this and sleep upon it?"". asked [Utterson]_n179. ""[I]_p836 wish [you]_p837 to judge for [me]_p838 entirely,"". was the reply. ""[I]_p839 have lost confidence in myself. ""Well, [I]_p840 shall consider,"".",2,,9,
stevenson_the_strange_case_of_drjekyll_and_mrhyde," returned the lawyer. ""And now one word more: [it]_p841 was [Hyde]_n180 who dictated the terms in [your]_p842 will about that disappearance? The doctor seemed seized with a qualm of faintness [he]_p843 shut [his]_p844 mouth tight and nodded. ""[I]_p845 knew it,"". said [Utterson]_n181. ""[He]_p846 meant to murder you. [You]_p847 had a fine escape. ""[I]_p848 have had what is far more to the purpose,"". returned the doctor solemnly:. ""[I]_p849 have had a lesson, O God, [Utterson]_n182 , what a lesson [I]_p850 have had!"". And [he]_p851 covered [his]_p852 face for a moment with [his]_p853 hands.",3,,13,
stevenson_the_strange_case_of_drjekyll_and_mrhyde," On [his]_p854 way out, the lawyer stopped and had a word or two with [Poole]_n183. ""By the bye,"". said he,. ""there was a letter handed in to-day: what was the messenger like?"". But [Poole]_n184 was positive nothing had come except by post. ""and only circulars by that,"". [he]_p855 added. This news sent off the visitor with [his]_p856 fears renewed. Plainly the letter had come by the laboratory door possibly, indeed, [it]_p857 had been written in the cabinet and if that were so, [it]_p858 must be differently judged, and handled with the more caution. The newsboys, as [he]_p859 went, were crying [themselves]_p860 hoarse along the footways:.",2,,7,
stevenson_the_strange_case_of_drjekyll_and_mrhyde," ""Special edition. Shocking murder of an M. P. "". That was the funeral oration of one friend and client and [he]_p861 could not help a certain apprehension lest the good name of another should be sucked down in the eddy of the scandal. [It]_p862 was, at least, a ticklish decision that [he]_p863 had to make and self-reliant as [he]_p864 was by habit, [he]_p864 began to cherish a longing for advice. [It]_p866 was not to be had directly but perhaps, [he]_p867 thought, [it]_p868 might be fished for. Presently after, [he]_p869 sat on one side of [his]_p870 own hearth, with [Mr Guest]_n185 , [his]_p871 head clerk, upon the other, and midway between, at a nicely calculated distance from the fire, a bottle of a particular old wine that had long dwelt unsunned in the foundations of [his]_p871 house. The fog still slept on the wing above the drowned city, where the lamps glimmered like carbuncles and through the muffle and smother of these fallen clouds, the procession of the town's life was still rolling in through the great arteries with a sound as of a mighty wind. But the room was gay with firelight.",1,,12,
stevenson_the_strange_case_of_drjekyll_and_mrhyde," In the bottle the acids were long ago resolved the imperial dye had softened with time, as the colour grows richer in stained windows and the glow of hot autumn afternoons on hillside vineyards, was ready to be set free and to disperse the fogs of [London]_n186. Insensibly the lawyer melted. There was no man from whom [he]_p873 kept fewer secrets than [Mr Guest]_n187 and [he]_p874 was not always sure that [he]_p874 kept as many as [he]_p875 meant. [Guest]_n188 had often been on business to the doctor's [he]_p877 knew [Poole]_n189 [he]_p878 could scarce have failed to hear of [Mr Hyde]_n190 's familiarity about the house [he]_p878 might draw conclusions: was [it]_p882 not as well, then, that [he]_p879 should see a letter which put that mystery to right? and above all since [Guest]_n191 , being a great student and critic of handwriting, would consider the step natural and obliging? The clerk, besides, was a man of counsel [he]_p879 could scarce read so strange a document without dropping a remark and by that remark [Mr Utterson]_n192 might shape [his]_p883 future course. ""This is a sad business about [Sir Danvers]_n193 ,"". [he]_p884 said. ""Yes, sir, indeed. [It]_p885 has elicited a great deal of public feeling, returned [Guest]_n194. ""The man, of course, was mad. ""[I]_p886 should like to hear [your]_p887 views on that,"".",9,,15,
stevenson_the_strange_case_of_drjekyll_and_mrhyde," replied [Utterson]_n195. ""[I]_p888 have a document here in [his]_p890 handwriting [it]_p891 is between ourselves, for [I]_p889 scarce know what to do about [it]_p892 [it]_p893 is an ugly business at the best. But there [it]_p894 is quite in [your]_p895 way: a murderer's autograph. [Guest]_n196 's eyes brightened, and [he]_p896 sat down at once and studied [it]_p897 with passion. ""No sir,"". [he]_p898 said:. ""not mad but [it]_p899 is an odd hand. ""And by all accounts a very odd writer,"". added the lawyer. Just then the servant entered with a note.",2,,12,
stevenson_the_strange_case_of_drjekyll_and_mrhyde," ""Is that from Dr Jekyll, sir?"". inquired the clerk. ""[I]_p900 thought [I]_p901 knew the writing. Anything private, [Mr Utterson]_n197 ?. ""Only an invitation to dinner. Why? Do [you]_p902 want to see it?. ""One moment. [I]_p903 thank you, sir "". and the clerk laid the two sheets of paper alongside and sedulously compared [their]_p904 contents. ""Thank you, sir,"".",1,,5,
stevenson_the_strange_case_of_drjekyll_and_mrhyde," [he]_p905 said at last, returning both. ""it's a very interesting autograph. There was a pause, during which [Mr Utterson]_n198 struggled with himself. ""Why did [you]_p906 compare them, [Guest]_n199 ?"". [he]_p907 inquired suddenly. ""Well, sir,"". returned the clerk,. ""there's a rather singular resemblance  the two hands are in many points identical: only differently sloped. ""Rather quaint,"". said [Utterson]_n200.",3,,3,
stevenson_the_strange_case_of_drjekyll_and_mrhyde," ""[It]_p908 is, as [you]_p909 say, rather quaint,"". returned [Guest]_n201. ""[I]_p910 wouldn't speak of this note, [you]_p911 know,"". said the master. ""No, sir,"". said the clerk. ""[I]_p912 understand. But no sooner was [Mr Utterson]_n202 alone that night, than [he]_p913 locked the note into [his]_p914 safe, where [it]_p915 reposed from that time forward. ""What!"". [he]_p916 thought.",2,,9,
stevenson_the_strange_case_of_drjekyll_and_mrhyde," ""[Henry Jekyll]_n203 forge for a murderer!"". And [his]_p917 blood ran cold in [his]_p918 veins. [INCIDENT]_n204 OF [DR]_n205. [LANYON]_n206 Time ran on thousands of pounds were offered in reward, for the death of [Sir Danvers]_n207 was resented as a public injury but [Mr Hyde]_n208 had disappeared out of the ken of the police as though [he]_p919 had never existed. Much of [his]_p920 past was unearthed, indeed, and all disreputable: tales came out of the man's cruelty, at once so callous and violent of [his]_p921 vile life, of [his]_p921 strange associates, of the hatred that seemed to have surrounded [his]_p922 career but of [his]_p922 present whereabouts, not a whisper. From the time [he]_p925 had left the house in [Soho]_n209 on the morning of the murder, [he]_p926 was simply blotted out and gradually, as time drew on, [Mr Utterson]_n210 began to recover from the hotness of [his]_p927 alarm, and to grow more at quiet with himself. The death of [Sir Danvers]_n211 was, to [his]_p928 way of thinking, more than paid for by the disappearance of [Mr Hyde]_n212. Now that that evil influence had been withdrawn, a new life began for Dr Jekyll. [He]_p929 came out of [his]_p930 seclusion, renewed relations with [his]_p931 friends, became once more [their]_p932 familiar guest and entertainer and whilst [he]_p933 had always been known for charities, [he]_p934 was now no less distinguished for religion. [He]_p935 was busy, [he]_p936 was much in the open air, [he]_p937 did good [his]_p938 face seemed to open and brighten, as if with an inward consciousness of service and for more than two months, the doctor was at peace.",10,,22,
stevenson_the_strange_case_of_drjekyll_and_mrhyde," On the 8th of [January Utterson]_n213 had dined at the doctor's with a small party [Lanyon]_n214 had been there and the face of the host had looked from one to the other as in the old days when the trio were inseparable friends. On the 12th, and again on the 14th, the door was shut against the lawyer. ""The doctor was confined to the house,"". [Poole]_n215 said,. ""and saw no one. "". On the 15th, [he]_p939 tried again, and was again refused and having now been used for the last two months to see [his]_p941 friend almost daily, [he]_p940 found this return of solitude to weigh upon [his]_p942 spirits. The fifth night [he]_p943 had in [Guest]_n216 to dine with [him]_p945 and the sixth [he]_p944 betook [himself]_p946 to [Dr Lanyon]_n217 's. There at least [he]_p947 was not denied admittance but when [he]_p948 came in, [he]_p948 was shocked at the change which had taken place in the doctor's appearance. [He]_p950 had [his]_p951 death-warrant written legibly upon [his]_p952 face.",5,,14,
stevenson_the_strange_case_of_drjekyll_and_mrhyde," The rosy man had grown pale [his]_p953 flesh had fallen away [he]_p954 was visibly balder and older  and yet [it]_p955 was not so much these tokens of a swift physical decay that arrested the lawyer's notice, as a look in the eye and quality of manner that seemed to testify to some deep-seated terror of the mind. [It]_p956 was unlikely that the doctor should fear death and yet that was what [Utterson]_n218 was tempted to suspect. ""Yes,"". [he]_p957 thought. ""[he]_p958 is a doctor, [he]_p959 must know [his]_p961 own state and that [his]_p962 days are counted and the knowledge is more than [he]_p959 can bear. "". And yet when [Utterson]_n219 remarked on [his]_p963 ill-looks, [it]_p964 was with an air of great firmness that [Lanyon]_n220 declared [himself]_p965 a doomed man. ""[I]_p966 have had a shock,"". [he]_p967 said,. ""and [I]_p968 shall never recover.",3,,16,
stevenson_the_strange_case_of_drjekyll_and_mrhyde," [It]_p969 is a question of weeks. Well, life has been pleasant [I]_p970 liked [it]_p972 yes, sir, [I]_p971 used to like it. [I]_p974 sometimes think if [we]_p975 knew all, [we]_p976 should be more glad to get away. ""[Jekyll]_n221 is ill, too,"". observed [Utterson]_n222. ""Have [you]_p977 seen him? But [Lanyon]_n223 's face changed, and [he]_p978 held up a trembling hand. ""[I]_p979 wish to see or hear no more of Dr Jekyll,"". [he]_p980 said in a loud, unsteady voice. ""[I]_p981 am quite done with that person and [I]_p982 beg that [you]_p984 will spare [me]_p985 any allusion to one whom [I]_p982 regard as dead. ""[Tut-tut]_n224 ,"".",4,,16,
stevenson_the_strange_case_of_drjekyll_and_mrhyde," said [Mr Utterson]_n225 and then after a considerable pause,. ""Can't [I]_p986 do anything?"". [he]_p987 inquired. ""[We]_p988 are three very old friends, [Lanyon]_n226 [we]_p989 shall not live to make others. ""Nothing can be done,"". returned [Lanyon]_n227. ""ask himself. ""[He]_p990 will not see me,"". said the lawyer. ""[I]_p991 am not surprised at that,"".",3,,6,
stevenson_the_strange_case_of_drjekyll_and_mrhyde," was the reply. ""Some day, [Utterson]_n228 , after [I]_p992 am dead, [you]_p993 may perhaps come to learn the right and wrong of this. [I]_p994 cannot tell you. And in the meantime, if [you]_p995 can sit and talk with [me]_p997 of other things, for God's sake, stay and do so but if [you]_p996 cannot keep clear of this accursed topic, then in God's name, go, for [I]_p998 cannot bear it. As soon as [he]_p999 got home, [Utterson]_n229 sat down and wrote to [Jekyll]_n230 , complaining of [his]_p1000 exclusion from the house, and asking the cause of this unhappy break with [Lanyon]_n231 and the next day brought [him]_p1001 a long answer, often very pathetically worded, and sometimes darkly mysterious in drift. The quarrel with [Lanyon]_n232 was incurable. ""[I]_p1002 do not blame [our]_p1003 old friend,"". [Jekyll]_n233 wrote,. ""but [I]_p1004 share [his]_p1005 view that [we]_p1006 must never meet. [I]_p1007 mean from henceforth to lead a life of extreme seclusion [you]_p1008 must not be surprised, nor must [you]_p1009 doubt [my]_p1011 friendship, if [my]_p1012 door is often shut even to you.",6,,20,
stevenson_the_strange_case_of_drjekyll_and_mrhyde," [You]_p1013 must suffer [me]_p1014 to go [my]_p1015 own dark way. [I]_p1016 have brought on [myself]_p1018 a punishment and a danger that [I]_p1017 cannot name. If [I]_p1019 am the chief of sinners, [I]_p1020 am the chief of sufferers also. [I]_p1021 could not think that this earth contained a place for sufferings and terrors so unmanning and [you]_p1022 can do but one thing, [Utterson]_n234 , to lighten this destiny, and that is to respect [my]_p1023 silence. "". [Utterson]_n235 was amazed the dark influence of [Hyde]_n236 had been withdrawn, the doctor had returned to [his]_p1024 old tasks and amities a week ago, the prospect had smiled with every promise of a cheerful and an honoured age and now in a moment, friendship, and peace of mind, and the whole tenor of [his]_p1025 life were wrecked. So great and unprepared a change pointed to madness but in view of [Lanyon]_n237 's manner and words, there must lie for [it]_p1026 some deeper ground. A week afterwards [Dr Lanyon]_n238 took to [his]_p1027 bed, and in something less than a fortnight [he]_p1028 was dead. The night after the funeral, at which [he]_p1029 had been sadly affected, [Utterson]_n239 locked the door of [his]_p1030 business room, and sitting there by the light of a melancholy candle, drew out and set before [him]_p1032 an envelope addressed by the hand and sealed with the seal of [his]_p1031 dead friend. ""PRIVATE: for the hands of G.",6,,20,
stevenson_the_strange_case_of_drjekyll_and_mrhyde," J. [Utterson ALONE]_n240 , and in case of [his]_p1033 predecease to be destroyed unread,"". so [it]_p1034 was emphatically superscribed and the lawyer dreaded to behold the contents. ""[I]_p1035 have buried one friend to-day,"". [he]_p1036 thought:. ""what if this should cost [me]_p1037 another?"". And then [he]_p1038 condemned the fear as a disloyalty, and broke the seal. Within there was another enclosure, likewise sealed, and marked upon the cover as. ""not to be opened till the death or disappearance of [Dr Henry Jekyll]_n241. "".",2,,6,
stevenson_the_strange_case_of_drjekyll_and_mrhyde," [Utterson]_n242 could not trust [his]_p1039 eyes. Yes, [it]_p1040 was disappearance here again, as in the mad will which [he]_p1041 had long ago restored to [its]_p1042 author, here again were the idea of a disappearance and the name of [Henry Jekyll]_n243 bracketted. But in the will, that idea had sprung from the sinister suggestion of the man [Hyde]_n244 [it]_p1043 was set there with a purpose all too plain and horrible. Written by the hand of [Lanyon]_n245 , what should [it]_p1044 mean? A great curiosity came on the trustee, to disregard the prohibition and dive at once to the bottom of these mysteries but professional honour and faith to [his]_p1045 dead friend were stringent obligations and the packet slept in the inmost corner of [his]_p1046 private safe. [It]_p1047 is one thing to mortify curiosity, another to conquer [it]_p1048 and [it]_p1049 may be doubted if, from that day forth, [Utterson]_n246 desired the society of [his]_p1050 surviving friend with the same eagerness. [He]_p1051 thought of [him]_p1052 kindly but [his]_p1053 thoughts were disquieted and fearful. [He]_p1054 went to call indeed but [he]_p1055 was perhaps relieved to be denied admittance perhaps, in [his]_p1057 heart, [he]_p1056 preferred to speak with [Poole]_n247 upon the doorstep and surrounded by the air and sounds of the open city, rather than to be admitted into that house of voluntary bondage, and to sit and speak with [its]_p1058 inscrutable recluse. [Poole]_n248 had, indeed, no very pleasant news to communicate. The doctor, [it]_p1059 appeared, now more than ever confined [himself]_p1061 to the cabinet over the laboratory, where [he]_p1062 would sometimes even sleep [he]_p1063 was out of spirits, [he]_p1063 had grown very silent, [he]_p1064 did not read [it]_p1060 seemed as if [he]_p1064 had something on [his]_p1067 mind. [Utterson]_n249 became so used to the unvarying character of these reports, that [he]_p1068 fell off little by little in the frequency of [his]_p1069 visits.",8,,31,
stevenson_the_strange_case_of_drjekyll_and_mrhyde," [INCIDENT]_n250 AT THE [WINDOW]_n251 [It]_p1070 chanced on [Sunday]_n252 , when [Mr Utterson]_n253 was on [his]_p1071 usual walk with [Mr Enfield]_n254 , that [their]_p1072 way lay once again through the by-street and that when [they]_p1073 came in front of the door, both stopped to gaze on it. ""Well,"". said [Enfield]_n255 ,. ""that story's at an end at least. [We]_p1074 shall never see more of [Mr Hyde]_n256. ""[I]_p1075 hope not,"". said [Utterson]_n257. ""Did [I]_p1076 ever tell [you]_p1078 that [I]_p1077 once saw him, and shared [your]_p1079 feeling of repulsion?. ""[It]_p1080 was impossible to do the one without the other,"". returned [Enfield]_n258.",9,,11,
stevenson_the_strange_case_of_drjekyll_and_mrhyde," ""And by the way, what an ass [you]_p1081 must have thought me, not to know that this was a back way to Dr Jekyll's! [It]_p1082 was partly [your]_p1083 own fault that [I]_p1084 found [it]_p1086 out, even when [I]_p1085 did. ""So [you]_p1087 found [it]_p1089 out, did you?"". said [Utterson]_n259. ""But if that be so, [we]_p1090 may step into the court and take a look at the windows. To tell [you]_p1091 the truth, [I]_p1092 am uneasy about poor [Jekyll]_n260 and even outside, [I]_p1093 feel as if the presence of a friend might do [him]_p1094 good. The court was very cool and a little damp, and full of premature twilight, although the sky, high up overhead, was still bright with sunset. The middle one of the three windows was half-way open and sitting close beside it, taking the air with an infinite sadness of mien, like some disconsolate prisoner, Utterson saw Dr Jekyll. ""What! [Jekyll]_n261 !"". [he]_p1095 cried. ""[I]_p1096 trust [you]_p1097 are better.",3,,16,
stevenson_the_strange_case_of_drjekyll_and_mrhyde," ""[I]_p1098 am very low, [Utterson]_n262 ,"". replied the doctor drearily,. ""very low. [It]_p1099 will not last long, thank God. ""[You]_p1100 stay too much indoors,"". said the lawyer. ""[You]_p1101 should be out, whipping up the circulation like [Mr Enfield]_n263 and me. (This is [my]_p1102 cousin, Mr Enfield, Dr Jekyll. ) Come now get [your]_p1103 hat and take a quick turn with us. ""[You]_p1104 are very good,"".",2,,7,
stevenson_the_strange_case_of_drjekyll_and_mrhyde," sighed the other. ""[I]_p1105 should like to very much but no, no, no, [it]_p1107 is quite impossible [I]_p1106 dare not. But indeed, [Utterson]_n264 , [I]_p1108 am very glad to see [you]_p1110 this is really a great pleasure [I]_p1109 would ask [you]_p1111 and [Mr Enfield]_n265 up, but the place is really not fit. ""Why, then,"". said the lawyer, good-naturedly,. ""the best thing [we]_p1112 can do is to stay down here and speak with [you]_p1114 from where [we]_p1113 are. ""That is just what [I]_p1115 was about to venture to propose,"". returned the doctor with a smile. But the words were hardly uttered, before the smile was struck out of [his]_p1116 face and succeeded by an expression of such abject terror and despair, as froze the very blood of the two gentlemen below. [They]_p1117 saw [it]_p1118 but for a glimpse for the window was instantly thrust down  but that glimpse had been sufficient, and [they]_p1119 turned and left the court without a word.",2,,15,
stevenson_the_strange_case_of_drjekyll_and_mrhyde," In silence, too, [they]_p1120 traversed the by-street and [it]_p1122 was not until [they]_p1121 had come into a neighbouring thoroughfare, where even upon a [Sunday]_n266 there were still some stirrings of life, that [Mr Utterson]_n267 at last turned and looked at [his]_p1123 companion. [They]_p1124 were both pale and there was an answering horror in [their]_p1125 eyes. ""God forgive us, God forgive us,"". said [Mr Utterson]_n268. But [Mr Enfield]_n269 only nodded [his]_p1126 head very seriously, and walked on once more in silence. THE LAST NIGHT [Mr Utterson]_n270 was sitting by [his]_p1127 fireside one evening after dinner, when [he]_p1128 was surprised to receive a visit from [Poole]_n271. ""Bless me, [Poole]_n272 , what brings [you]_p1129 here?"". [he]_p1130 cried and then taking a second look at him,. ""What ails you?"". [he]_p1131 added.",7,,12,
