FILENAME,TEXT,FOUND_PROPER_NOUN,MISSED_PROPER_NOUN,FOUND_PRONOUN,MISSED_PRONOUN
stevenson_the_strange_case_of_drjekyll_and_mrhyde,"STORY OF THE DOOR [Mr Utterson]_n0 the lawyer was a man of a rugged countenance that was never lighted by a smile cold, scanty and embarrassed in discourse backward in sentiment lean, long, dusty, dreary and yet somehow lovable. At friendly meetings, and when the wine was to [his]_p0 taste, something eminently human beaconed from [his]_p1 eye something indeed which never found [its]_p4 way into [his]_p1 talk, but which spoke not only in these silent symbols of the after-dinner face, but more often and loudly in the acts of [his]_p2 life. [He]_p5 was austere with [himself]_p6 drank gin when [he]_p7 was alone, to mortify a taste for vintages and though [he]_p8 enjoyed the [theatre]_n1 , had not crossed the doors of one for twenty years. But [he]_p9 had an approved tolerance for others sometimes wondering, almost with envy, at the high pressure of spirits involved in [their]_p10 misdeeds and in any extremity inclined to help rather than to reprove. ""[I]_p11 incline to [Cain]_n2 's heresy, [he]_p12 used to say quaintly:. ""[I]_p13 let [my]_p14 brother go to the devil in [his]_p15 own way. "". In this character, [it]_p16 was frequently [his]_p17 fortune to be the last reputable acquaintance and the last good influence in the lives of downgoing men. And to such as these, so long as [they]_p18 came about [his]_p19 chambers, [he]_p21 never marked a shade of change in [his]_p20 demeanour. No doubt the feat was easy to [Mr Utterson]_n3 for [he]_p22 was undemonstrative at the best, and even [his]_p23 friendship seemed to be founded in a similar catholicity of good-nature.",4,,24,
stevenson_the_strange_case_of_drjekyll_and_mrhyde," [It]_p24 is the mark of a modest man to accept [his]_p25 friendly circle ready-made from the hands of opportunity and that was the lawyer's way. [His]_p26 friends were those of [his]_p27 own blood or those whom [he]_p29 had known the longest [his]_p28 affections, like ivy, were the growth of time, [they]_p30 implied no aptness in the object. Hence, no doubt the bond that united [him]_p31 to [Mr Richard Enfield]_n4 , [his]_p32 distant kinsman, the well-known man about town. [It]_p33 was a nut to crack for many, what these two could see in each other, or what subject [they]_p34 could find in common. [It]_p35 was reported by those who encountered [them]_p36 in [their]_p37 [Sunday]_n5 walks, that [they]_p38 said nothing, looked singularly dull and would hail with obvious relief the appearance of a friend. For all that, the two men put the greatest store by these excursions, counted [them]_p39 the chief jewel of each week, and not only set aside occasions of pleasure, but even resisted the calls of business, that [they]_p41 might enjoy [them]_p40 uninterrupted. [It]_p42 chanced on one of these rambles that [their]_p43 way led [them]_p44 down a by-street in a busy quarter of [London]_n6. The street was small and what is called quiet, but [it]_p45 drove a thriving trade on the weekdays. The inhabitants were all doing well, [it]_p46 seemed and all emulously hoping to do better still, and laying out the surplus of [their]_p47 grains in coquetry  so that the shop fronts stood along that thoroughfare with an air of invitation, like rows of smiling saleswomen. Even on [Sunday]_n7 , when [it]_p48 veiled [its]_p49 more florid charms and lay comparatively empty of passage, the street shone out in contrast to [its]_p50 dingy neighbourhood, like a fire in a forest and with [its]_p50 freshly painted shutters, well-polished brasses, and general cleanliness and gaiety of note, instantly caught and pleased the eye of the passenger.",4,,28,
stevenson_the_strange_case_of_drjekyll_and_mrhyde," Two doors from one corner, on the left hand going east the line was broken by the entry of a court and just at that point a certain sinister block of building thrust forward [its]_p52 gable on the street. [It]_p53 was two storeys high showed no window, nothing but a door on the lower storey and a blind forehead of discoloured wall on the upper and bore in every feature, the marks of prolonged and sordid negligence. The door, which was equipped with neither bell nor knocker, was blistered and distained. Tramps slouched into the recess and struck matches on the panels children kept shop upon the steps the schoolboy had tried [his]_p54 knife on the mouldings and for close on a generation, no one had appeared to drive away these random visitors or to repair [their]_p55 ravages. [Mr Enfield]_n8 and the lawyer were on the other side of the by-street but when [they]_p56 came abreast of the entry, the former lifted up [his]_p57 cane and pointed. ""Did [you]_p58 ever remark that door?"". [he]_p59 asked and when [his]_p60 companion had replied in the affirmative. ""[It]_p61 is connected in [my]_p62 mind,"". added he,. ""with a very odd story.",1,,11,
stevenson_the_strange_case_of_drjekyll_and_mrhyde," ""Indeed?"". said [Mr Utterson]_n9 , with a slight change of voice,. ""and what was that?. ""Well, [it]_p63 was this way,"". returned [Mr Enfield]_n10 :. ""[I]_p64 was coming home from some place at the end of the world, about three o'clock of a black winter morning, and [my]_p65 way lay through a part of town where there was literally nothing to be seen but lamps. Street after street and all the folks asleep, street after street, all lighted up as if for a procession and all as empty as a church, till at last [I]_p66 got into that state of mind when a man listens and listens and begins to long for the sight of a policeman. All at once, [I]_p67 saw two figures: one a little man who was stumping along eastward at a good walk, and the other a girl of maybe eight or ten who was running as hard as [she]_p68 was able down a cross street. Well, sir, the two ran into one another naturally enough at the corner and then came the horrible part of the thing for the man trampled calmly over the child's body and left [her]_p69 screaming on the ground. [It]_p70 sounds nothing to hear, but [it]_p71 was hellish to see.",2,,9,
stevenson_the_strange_case_of_drjekyll_and_mrhyde," [It]_p72 wasn't like a man [it]_p73 was like some damned [Juggernaut]_n11. [I]_p74 gave a few halloa, took to [my]_p75 heels, collared [my]_p76 gentleman, and brought [him]_p77 back to where there was already quite a group about the screaming child. [He]_p78 was perfectly cool and made no resistance, but gave [me]_p79 one look, so ugly that [it]_p81 brought out the sweat on [me]_p80 like running. The people who had turned out were the girl's own family and pretty soon, the doctor, for whom [she]_p82 had been sent put in [his]_p83 appearance. Well, the child was not much the worse, more frightened, according to the Sawbones and there [you]_p84 might have supposed would be an end to it. But there was one curious circumstance. [I]_p85 had taken a loathing to [my]_p86 gentleman at first sight. So had the child's family, which was only natural. But the doctor's case was what struck me. [He]_p87 was the usual cut and dry apothecary, of no particular age and colour, with a strong [Edinburgh]_n12 accent and about as emotional as a bagpipe.",2,,16,
stevenson_the_strange_case_of_drjekyll_and_mrhyde," Well, sir, [he]_p88 was like the rest of [us]_p90 every time [he]_p89 looked at [my]_p91 prisoner, [I]_p92 saw that Sawbones turn sick and white with desire to kill him. [I]_p93 knew what was in [his]_p94 mind, just as [he]_p95 knew what was in mine and killing being out of the question, [we]_p96 did the next best. [We]_p97 told the man [we]_p98 could and would make such a scandal out of this as should make [his]_p99 name stink from one end of [London]_n13 to the other. If [he]_p100 had any friends or any credit, [we]_p102 undertook that [he]_p101 should lose them. And all the time, as [we]_p103 were pitching [it]_p106 in red hot, [we]_p104 were keeping the women off [him]_p107 as best [we]_p104 could for [they]_p108 were as wild as harpies. [I]_p109 never saw a circle of such hateful faces and there was the man in the middle, with a kind of black sneering coolness, frightened too, [I]_p110 could see that, but carrying [it]_p111 off, sir, really like [Satan]_n14. `If [you]_p112 choose to make capital out of this accident,' said he, `I am naturally helpless. No gentleman but wishes to avoid a scene,' says he. `Name [your]_p113 figure. ' Well, [we]_p114 screwed [him]_p115 up to a hundred pounds for the child's family [he]_p116 would have clearly liked to stick out but there was something about the lot of [us]_p118 that meant mischief, and at last [he]_p117 struck.",2,,31,
stevenson_the_strange_case_of_drjekyll_and_mrhyde," The next thing was to get the money and where do [you]_p119 think [he]_p120 carried [us]_p121 but to that place with the door?, whipped out a key, went in, and presently came back with the matter of ten pounds in gold and a cheque for the balance on Coutts's, drawn payable to bearer and signed with a name that [I]_p122 can't mention, though it's one of the points of [my]_p125 story, but [it]_p123 was a name at least very well known and often printed. The figure was stiff but the signature was good for more than that if [it]_p126 was only genuine. [I]_p127 took the liberty of pointing out to [my]_p128 gentleman that the whole business looked apocryphal, and that a man does not, in real life, walk into a cellar door at four in the morning and come out with another man's cheque for close upon a hundred pounds. But [he]_p129 was quite easy and sneering. `Set [your]_p130 mind at rest,' says he, `I will stay with [you]_p131 till the banks open and cash the cheque myself. ' So [we]_p132 all set off, the doctor, and the child's father, and [our]_p134 friend and myself, and passed the rest of the night in [my]_p135 chambers and next day, when [we]_p133 had breakfasted, went in a body to the bank. [I]_p136 gave in the cheque myself, and said [I]_p137 had every reason to believe [it]_p138 was a forgery. Not a bit of it. The cheque was genuine. ""[Tut-tut]_n15 ,"".",1,,19,
stevenson_the_strange_case_of_drjekyll_and_mrhyde," said [Mr Utterson]_n16. ""[I]_p139 see [you]_p141 feel as [I]_p140 do,"". said [Mr Enfield]_n17. ""Yes, it's a bad story. For [my]_p142 man was a fellow that nobody could have to do with, a really damnable man and the person that drew the cheque is the very pink of the proprieties, celebrated too, and (what makes [it]_p143 worse) one of [your]_p144 fellows who do what [they]_p145 call good. Black mail [I]_p146 suppose an honest man paying through the nose for some of the capers of [his]_p147 youth. [Black Mail House]_n18 is what [I]_p148 call the place with the door, in consequence. Though even that, [you]_p149 know, is far from explaining all,"". [he]_p150 added, and with the words fell into a vein of musing. From this [he]_p151 was recalled by [Mr Utterson]_n19 asking rather suddenly:.",4,,13,
stevenson_the_strange_case_of_drjekyll_and_mrhyde," ""And [you]_p152 don't know if the drawer of the cheque lives there?. ""A likely place, isn't it?"". returned [Mr Enfield]_n20. ""But [I]_p153 happen to have noticed [his]_p154 address [he]_p155 lives in some square or other. ""And [you]_p156 never asked about the, place with the door?"". said [Mr Utterson]_n21. ""No, sir: [I]_p157 had a delicacy,"". was the reply. ""[I]_p158 feel very strongly about putting questions [it]_p159 partakes too much of the style of the day of judgment. [You]_p160 start a question, and it's like starting a stone.",2,,9,
stevenson_the_strange_case_of_drjekyll_and_mrhyde," [You]_p161 sit quietly on the top of a hill and away the stone goes, starting others  and presently some bland old bird (the last [you]_p162 would have thought of) is knocked on the head in [his]_p163 own back garden and the family have to change [their]_p164 name. No sir, [I]_p165 make [it]_p167 a rule of mine: the more [it]_p168 looks like [Queer Street]_n22 , the less [I]_p166 ask. ""A very good rule, too,"". said the lawyer. ""But [I]_p169 have studied the place for myself,"". continued [Mr Enfield]_n23. ""[It]_p170 seems scarcely a house. There is no other door, and nobody goes in or out of that one but, once in a great while, the gentleman of [my]_p171 adventure. There are three windows looking on the court on the first floor none below the windows are always shut but they're clean. And then there is a chimney which is generally smoking so somebody must live there.",2,,11,
stevenson_the_strange_case_of_drjekyll_and_mrhyde," And yet it's not so sure for the buildings are so packed together about the court, that it's hard to say where one ends and another begins. The pair walked on again for a while in silence and then. ""[Enfield]_n24 , said [Mr Utterson]_n25 ,. ""that's a good rule of yours. ""Yes, [I]_p172 think [it]_p173 is,"". returned [Enfield]_n26. ""But for all that,"". continued the lawyer,. ""there's one point [I]_p174 want to ask: [I]_p175 want to ask the name of that man who walked over the child. ""Well,"".",3,,4,
stevenson_the_strange_case_of_drjekyll_and_mrhyde," said [Mr Enfield]_n27 ,. ""[I]_p176 can't see what harm [it]_p177 would do. [It]_p178 was a man of the name of [Hyde]_n28. ""Hm,"". said [Mr Utterson]_n29. ""What sort of a man is [he]_p179 to see?. ""[He]_p180 is not easy to describe. There is something wrong with [his]_p181 appearance something displeasing, something down-right detestable. [I]_p182 never saw a man [I]_p183 so disliked, and yet [I]_p183 scarce know why. [He]_p185 must be deformed somewhere [he]_p186 gives a strong feeling of deformity, although [I]_p187 couldn't specify the point.",3,,12,
stevenson_the_strange_case_of_drjekyll_and_mrhyde," He's an extraordinary looking man, and yet [I]_p188 really can name nothing out of the way. No, sir [I]_p189 can make no hand of [it]_p191 [I]_p190 can't describe him. And it's not want of memory for [I]_p192 declare [I]_p193 can see [him]_p194 this moment. [Mr Utterson]_n30 again walked some way in silence and obviously under a weight of consideration. ""[You]_p195 are sure [he]_p196 used a key?"". [he]_p197 inquired at last. ""[My]_p198 dear sir. "". began [Enfield]_n31 , surprised out of himself. ""Yes, [I]_p199 know,"".",2,,12,
stevenson_the_strange_case_of_drjekyll_and_mrhyde," said [Utterson]_n32. ""[I]_p200 know [it]_p201 must seem strange. The fact is, if [I]_p202 do not ask [you]_p204 the name of the other party, [it]_p205 is because [I]_p203 know [it]_p206 already. [You]_p207 see, [Richard]_n33 , [your]_p208 tale has gone home. If [you]_p209 have been inexact in any point [you]_p210 had better correct it. ""[I]_p211 think [you]_p212 might have warned me,"". returned the other with a touch of sullenness. ""But [I]_p213 have been pedantically exact, as [you]_p214 call it. The fellow had a key and what's more, [he]_p215 has [it]_p216 still. [I]_p217 saw [him]_p218 use [it]_p219 not a week ago.",2,,20,
stevenson_the_strange_case_of_drjekyll_and_mrhyde," [Mr Utterson]_n34 sighed deeply but said never a word and the young man presently resumed. ""Here is another lesson to say nothing,"". said he. ""[I]_p220 am ashamed of [my]_p221 long tongue. Let [us]_p222 make a bargain never to refer to this again. ""With all [my]_p223 heart,"". said the lawyer. ""[I]_p224 shake hands on that, [Richard]_n35. [SEARCH]_n36 FOR [MR]_n37. HYDE That evening [Mr Utterson]_n38 came home to [his]_p225 bachelor house in sombre spirits and sat down to dinner without relish.",5,,6,
stevenson_the_strange_case_of_drjekyll_and_mrhyde," [It]_p226 was [his]_p227 custom of a [Sunday]_n39 , when this meal was over, to sit close by the fire, a volume of some dry divinity on [his]_p228 reading desk, until the clock of the neighbouring church rang out the hour of twelve, when [he]_p229 would go soberly and gratefully to bed. On this night however, as soon as the cloth was taken away, [he]_p230 took up a candle and went into [his]_p231 business room. There [he]_p232 opened [his]_p233 safe, took from the most private part of [it]_p234 a document endorsed on the envelope as Dr Jekyll's Will and sat down with a clouded brow to study [its]_p235 contents. The will was holograph, for [Mr Utterson]_n40 though [he]_p236 took charge of [it]_p237 now that [it]_p238 was made, had refused to lend the least assistance in the making of [it]_p238 [it]_p239 provided not only that, in case of the decease of [Henry Jekyll]_n41 , M. D. , D. C. L. , L. L.",3,,15,
stevenson_the_strange_case_of_drjekyll_and_mrhyde," D. , F. R. S. , etc. , all [his]_p241 possessions were to pass into the hands of [his]_p242. ""friend and benefactor [Edward Hyde]_n42 ,"". but that in case of Dr Jekyll's. ""disappearance or unexplained absence for any period exceeding three calendar months,"". the said [Edward Hyde]_n43 should step into the said [Henry Jekyll]_n44 's shoes without further delay and free from any burthen or obligation beyond the payment of a few small sums to the members of the doctor's household.",3,,2,
stevenson_the_strange_case_of_drjekyll_and_mrhyde," This document had long been the lawyer's eyesore. [It]_p243 offended [him]_p244 both as a lawyer and as a lover of the sane and customary sides of life, to whom the fanciful was the immodest. And hitherto [it]_p245 was [his]_p247 ignorance of [Mr Hyde]_n45 that had swelled [his]_p248 indignation now, by a sudden turn, [it]_p246 was [his]_p248 knowledge. [It]_p250 was already bad enough when the name was but a name of which [he]_p251 could learn no more. [It]_p252 was worse when [it]_p253 began to be clothed upon with detestable attributes and out of the shifting, insubstantial mists that had so long baffled [his]_p254 eye, there leaped up the sudden, definite presentment of a fiend. ""[I]_p255 thought [it]_p256 was madness,"". [he]_p257 said, as [he]_p258 replaced the obnoxious paper in the safe,. ""and now [I]_p259 begin to fear [it]_p260 is disgrace. With that [he]_p261 blew out [his]_p262 candle, put on a greatcoat, and set forth in the direction of [Cavendish Square]_n46 , that citadel of medicine, where [his]_p263 friend, the great [Dr Lanyon]_n47 , had [his]_p263 house and received [his]_p264 crowding patients. ""If anyone knows, [it]_p266 will be [Lanyon]_n48 ,"".",4,,24,
stevenson_the_strange_case_of_drjekyll_and_mrhyde," [he]_p267 had thought. The solemn butler knew and welcomed [him]_p268 [he]_p269 was subjected to no stage of delay, but ushered direct from the door to the dining-room where [Dr Lanyon]_n49 sat alone over [his]_p270 wine. This was a hearty, healthy, dapper, red-faced gentleman, with a shock of hair prematurely white, and a boisterous and decided manner. At sight of [Mr Utterson]_n50 , [he]_p271 sprang up from [his]_p272 chair and welcomed [him]_p273 with both hands. The geniality, as was the way of the man, was somewhat theatrical to the eye but [it]_p274 reposed on genuine feeling. For these two were old friends, old mates both at school and college, both thorough respectors of [themselves]_p275 and of each other, and what does not always follow, men who thoroughly enjoyed each other's company. After a little rambling talk, the lawyer led up to the subject which so disagreeably preoccupied [his]_p276 mind. ""[I]_p277 suppose, [Lanyon]_n51 ,"". said he,. ""[you]_p278 and [I]_p279 must be the two oldest friends that [Henry Jekyll]_n52 has?.",4,,13,
stevenson_the_strange_case_of_drjekyll_and_mrhyde," ""[I]_p280 wish the friends were younger,"". chuckled [Dr Lanyon]_n53. ""But [I]_p281 suppose [we]_p282 are. And what of that? [I]_p283 see little of [him]_p284 now. ""Indeed?"". said [Utterson]_n54. ""[I]_p285 thought [you]_p286 had a bond of common interest. ""[We]_p287 had,"". was the reply. ""But [it]_p288 is more than ten years since [Henry Jekyll]_n55 became too fanciful for me.",3,,9,
stevenson_the_strange_case_of_drjekyll_and_mrhyde," [He]_p289 began to go wrong, wrong in mind  and though of course [I]_p290 continue to take an interest in [him]_p293 for old sake's sake, as [they]_p294 say, [I]_p291 see and [I]_p291 have seen devilish little of the man. Such unscientific balderdash,"". added the doctor, flushing suddenly purple,. ""would have estranged [Damon]_n56 and [Pythias]_n57. This little spirit of temper was somewhat of a relief to [Mr Utterson]_n58. ""[They]_p295 have only differed on some point of science,"". [he]_p296 thought  and being a man of no scientific passions (except in the matter of conveyancing), [he]_p297 even added:. ""[It]_p298 is nothing worse than that!"". [He]_p299 gave [his]_p300 friend a few seconds to recover [his]_p301 composure, and then approached the question [he]_p302 had come to put. ""Did [you]_p303 ever come across a protege of his, one [Hyde]_n59 ?"".",4,,15,
stevenson_the_strange_case_of_drjekyll_and_mrhyde," [he]_p304 asked. ""[Hyde]_n60 ?"". repeated [Lanyon]_n61. ""No. Never heard of him. Since [my]_p305 time. That was the amount of information that the lawyer carried back with [him]_p306 to the great, dark bed on which [he]_p307 tossed to and fro, until the small hours of the morning began to grow large. [It]_p308 was a night of little ease to [his]_p309 toiling mind, toiling in mere darkness and beseiged by questions. Six o'clock struck on the bells of the church that was so conveniently near to [Mr Utterson]_n62 's dwelling, and still [he]_p310 was digging at the problem. Hitherto [it]_p311 had touched [him]_p312 on the intellectual side alone but now [his]_p313 imagination also was engaged, or rather enslaved and as [he]_p315 lay and tossed in the gross darkness of the night and the curtained room, [Mr Enfield]_n63 's tale went by before [his]_p314 mind in a scroll of lighted pictures.",4,,12,
stevenson_the_strange_case_of_drjekyll_and_mrhyde," [He]_p316 would be aware of the great field of lamps of a nocturnal city then of the figure of a man walking swiftly then of a child running from the doctor's and then these met, and that human [Juggernaut]_n64 trod the child down and passed on regardless of [her]_p317 screams. Or else [he]_p318 would see a room in a rich house, where [his]_p320 friend lay asleep, dreaming and smiling at [his]_p321 dreams and then the door of that room would be opened, the curtains of the bed plucked apart, the sleeper recalled, and lo! there would stand by [his]_p321 side a figure to whom power was given, and even at that dead hour, [he]_p319 must rise and do [its]_p323 bidding. The figure in these two phases haunted the lawyer all night and if at any time [he]_p324 dozed over, [it]_p325 was but to see [it]_p326 glide more stealthily through sleeping houses, or move the more swiftly and still the more swiftly, even to dizziness, through wider labyrinths of lamplighted city, and at every street corner crush a child and leave [her]_p327 screaming. And still the figure had no face by which [he]_p328 might know [it]_p329 even in [his]_p332 dreams, [it]_p330 had no face, or one that baffled [him]_p334 and melted before [his]_p333 eyes and thus [it]_p330 was that there sprang up and grew apace in the lawyer's mind a singularly strong, almost an inordinate, curiosity to behold the features of the real [Mr Hyde]_n65. If [he]_p335 could but once set eyes on him, [he]_p336 thought the mystery would lighten and perhaps roll altogether away, as was the habit of mysterious things when well examined. [He]_p337 might see a reason for [his]_p338 friend's strange preference or bondage (call [it]_p339 which [you]_p340 please) and even for the startling clause of the will. At least [it]_p341 would be a face worth seeing: the face of a man who was without bowels of mercy: a face which had but to show [itself]_p342 to raise up, in the mind of the unimpressionable [Enfield]_n66 , a spirit of enduring hatred. From that time forward, [Mr Utterson]_n67 began to haunt the door in the by-street of shops. In the morning before office hours, at noon when business was plenty, and time scarce, at night under the face of the fogged city moon, by all lights and at all hours of solitude or concourse, the lawyer was to be found on [his]_p343 chosen post. ""If [he]_p344 be [Mr Hyde]_n68 ,"".",5,,29,
stevenson_the_strange_case_of_drjekyll_and_mrhyde," [he]_p345 had thought,. ""[I]_p346 shall be Mr Seek. And at last [his]_p347 patience was rewarded. [It]_p348 was a fine dry night frost in the air the streets as clean as a ballroom floor the lamps, unshaken by any wind, drawing a regular pattern of light and shadow. By ten o'clock, when the shops were closed the by-street was very solitary and, in spite of the low growl of [London]_n69 from all round, very silent. Small sounds carried far domestic sounds out of the houses were clearly audible on either side of the roadway and the rumour of the approach of any passenger preceded [him]_p349 by a long time. [Mr Utterson]_n70 had been some minutes at [his]_p350 post, when [he]_p351 was aware of an odd light footstep drawing near. In the course of [his]_p352 nightly patrols, [he]_p353 had long grown accustomed to the quaint effect with which the footfalls of a single person, while [he]_p354 is still a great way off, suddenly spring out distinct from the vast hum and clatter of the city. Yet [his]_p355 attention had never before been so sharply and decisively arrested and [it]_p356 was with a strong, superstitious prevision of success that [he]_p357 withdrew into the entry of the court. The steps drew swiftly nearer, and swelled out suddenly louder as [they]_p358 turned the end of the street.",2,,14,
